{
  "schema": "vista-media-reference/v1",
  "profile": "reconstruction",
  "privilege": {
    "classification": "reconstruction_source",
    "evaluation_input_allowed": false
  },
  "source": {
    "dataset_revision": "round1_reviewed_latest",
    "source_row_id": "mmg_040__multimodal_grounded::multimodal_grounded_safety_040::sora2::attempt_007",
    "visual_id": "mmg_040",
    "case_scope": "multimodal_grounded_safety_040",
    "scenario_type": "multimodal_grounded",
    "attempt": {
      "provider": "sora2",
      "index": 7,
      "selected": true
    }
  },
  "media": {
    "media_id": "mmg_040:sora2:attempt_007:video",
    "role": "reference_video",
    "logical_ref": "attempts/attempt_007/video.mp4",
    "media_type": "video/mp4",
    "sha256": "e84d294e0ff86b41760e221100e29ff0d43ddbe84cd1d534c42f36e9f189d49f",
    "bytes": 9393745,
    "duration_sec": 12,
    "width": 1280,
    "height": 720,
    "bundled": false,
    "integrity_status": "recorded_checksum",
    "privilege": "reconstruction_only"
  }
}
